{
  "$schema": "https://circuitpartitioning.org/schemas/v1/benchmark-run.schema.json",
  "schema_version": "1.0.0-draft.1",
  "type": "benchmark-run",
  "id": "mini-pipeline-reference-run",
  "circuit": {
    "id": "mini-pipeline",
    "version": "1.0.0",
    "sha256": "37b200d9cb21185d53aa9120e3980ebc10dbf9aab4aeb3e5ed605a93c8964979"
  },
  "topology": {
    "id": "two-fpga-link",
    "version": "1.0.0",
    "sha256": "263e6a599259a71165ade8cb70c3e4b299988b6847ac8e67894d4e3db129c62d"
  },
  "partition": {
    "id": "mini-pipeline-split",
    "version": "1.0.0",
    "sha256": "22b5fed798cb1f0167b2db8ca74e550122fbd0dd98494ee8cc9ca08642bd66ba"
  },
  "algorithm": {
    "name": "hand-authored-reference",
    "version": "1.0.0",
    "parameters": {
      "objective": "demonstrate-metrics"
    },
    "seed": 0
  },
  "status": "succeeded",
  "started_at": "2026-08-03T00:00:00Z",
  "duration_ms": 0,
  "memory_peak_mb": 0,
  "environment": {
    "os": "platform-independent",
    "architecture": "not-applicable",
    "details": {
      "method": "analytically-derived-reference"
    }
  },
  "metrics": [
    {
      "metric_id": "critical-path",
      "value": 3,
      "unit": "ns",
      "status": "declared",
      "conventions_version": "1.0.0-draft.1"
    },
    {
      "metric_id": "partitioned-critical-path",
      "value": 13,
      "unit": "ns",
      "status": "declared",
      "conventions_version": "1.0.0-draft.1"
    },
    {
      "metric_id": "cut-size",
      "value": 2,
      "status": "declared",
      "conventions_version": "1.0.0-draft.1"
    },
    {
      "metric_id": "connectivity-minus-one",
      "value": 2,
      "status": "declared",
      "conventions_version": "1.0.0-draft.1"
    }
  ]
}

